{"counts":{"blocker":0,"critical":0,"info":0,"warning":0},"findings":[],"profile":"product","schema_version":"1.0.0","source":"docs/product-technology-report-2026-07-28.md","source_sha256":"3e8e3deb6820173bd3d9bbc9e3a62a9e32349351007674df13cbf048e8d270e4","standard_version":"1.0.0","status":"pass"}
