{"counts":{"blocker":0,"critical":0,"info":0,"warning":0},"findings":[],"profile":"operational","schema_version":"1.0.0","source":"documents/DOC-1cc579c8-pj-capability-overview-v1.md","source_sha256":"f4020cf7a8696072bb8904dc2b0d39e1428523e43d1881e3d007de97caa9d016","standard_version":"1.0.0","status":"pass"}
