{"counts":{"blocker":0,"critical":0,"info":0,"warning":0},"findings":[],"profile":"operational","schema_version":"1.0.0","source":"documents/DOC-985fcc33-pj-session-startup-v1.md","source_sha256":"983bd80322a46ca0fe482f6569b85a8746d3e0b99e401f7995d4507d312b0433","standard_version":"1.0.0","status":"pass"}
